"|","question","department","relevance"
"3w1","Os atuais sócios possuem experiência empresarial exitosa e/ou contam com executivos experientes?","gestão estratégica","false"
"3w2","Com relação à sucessão e continuidade empresarial, constata-se que os mais jovens estão ascendendo na hierarquia e/ou há abertura para novos sócios e diretores?","gestão estratégica","false"
"3w3","Os prazos das entregas dos produtos/serviços no mercado, estão sendo cumpridos? ","comercial","false"
"3w4","O ciclo de vida dos principais produtos/serviços sofre interferência da moda? A empresa leva em consideração o modismo e sabe lidar com esse aspecto?","gestão estratégica","false"
"3w5","A empresa considera que mudanças e evoluções tecnológicas afetam os seus produtos/serviços e sabe lidar bem com esse aspecto?","gestão estratégica","false"
"3w6","À medida que o tempo passa é avaliada se a localização do estabelecimento continua vantajosa?","gestão estratégica","false"
